{
  "contract_version": "1.0.0",
  "record_id": "HANDOVER-SYN-004",
  "scenario_id": "SCENARIO-SYN-004",
  "synthetic": true,
  "generated_at": "2026-01-15T18:00:00Z",
  "handover_at": "2026-01-15T17:30:00Z",
  "shift_window": {
    "start": "2026-01-15T06:00:00Z",
    "end": "2026-01-15T18:00:00Z"
  },
  "work_front": {
    "id": "WF-SYN-004",
    "label": "Synthetic work front 4",
    "scope_summary": "Fictional maintenance coordination scenario.",
    "overall_state": "unknown",
    "change_since_last": "Synthetic state change recorded for contract testing."
  },
  "incoming_view": {
    "headline": "No sufficient evidence supports a current work-front state.",
    "priority_condition": "unknown",
    "blockers": [
      "Current state cannot be established from the synthetic record."
    ],
    "next_actions": [
      {
        "action_id": "ACT-SYN-004",
        "description": "Establish the current evidence state through the applicable human process.",
        "owner_role": "incoming_supervisor",
        "timing": "immediate"
      }
    ]
  },
  "assertions": [
    {
      "assertion_id": "AST-SYN-004",
      "subject": "Synthetic task state",
      "reported_state": "unknown",
      "evidence_disposition": "missing",
      "evidence_refs": [],
      "confidence": "unknown",
      "observed_at": "2026-01-15T17:20:00Z",
      "limitations": [
        "Synthetic scenario; no field verification."
      ]
    }
  ],
  "evidence_items": [],
  "interruptions": [],
  "authority_boundary": {
    "authorizes_work": false,
    "confirms_isolation": false,
    "approves_permit": false,
    "declares_safe": false,
    "statement": "Evidence record only. Follow site procedures and competent-person authority."
  },
  "provenance": {
    "source_mode": "synthetic",
    "generator": "m1-fixture-builder",
    "seed": 4,
    "no_real_site_data": true
  },
  "limitations": [
    "Synthetic contract fixture; not operational evidence."
  ]
}
