{
  "contract_version": "1.0.0",
  "record_id": "HANDOVER-SYN-001",
  "scenario_id": "SCENARIO-SYN-001",
  "synthetic": true,
  "generated_at": "2026-01-15T18:00:00Z",
  "handover_at": "2026-01-15T17:30:00Z",
  "shift_window": {
    "start": "2026-01-15T06:00:00Z",
    "end": "2026-01-15T18:00:00Z"
  },
  "work_front": {
    "id": "WF-SYN-001",
    "label": "Synthetic work front 1",
    "scope_summary": "Fictional maintenance coordination scenario.",
    "overall_state": "in_progress",
    "change_since_last": "Synthetic state change recorded for contract testing."
  },
  "incoming_view": {
    "headline": "Progress is reported and supported by a synthetic observation.",
    "priority_condition": "state_change",
    "blockers": [],
    "next_actions": [
      {
        "action_id": "ACT-SYN-001",
        "description": "Review the next synthetic task dependency.",
        "owner_role": "incoming_supervisor",
        "timing": "next_shift"
      }
    ]
  },
  "assertions": [
    {
      "assertion_id": "AST-SYN-001",
      "subject": "Synthetic task state",
      "reported_state": "in_progress",
      "evidence_disposition": "supported",
      "evidence_refs": [
        "EV-SYN-001"
      ],
      "confidence": "medium",
      "observed_at": "2026-01-15T17:20:00Z",
      "limitations": [
        "Synthetic scenario; no field verification."
      ]
    }
  ],
  "evidence_items": [
    {
      "evidence_id": "EV-SYN-001",
      "synthetic": true,
      "evidence_type": "observation",
      "captured_at": "2026-01-15T17:15:00Z",
      "source_role": "synthetic_outgoing_role",
      "integrity_status": "available"
    }
  ],
  "interruptions": [],
  "authority_boundary": {
    "authorizes_work": false,
    "confirms_isolation": false,
    "approves_permit": false,
    "declares_safe": false,
    "statement": "Evidence record only. Follow site procedures and competent-person authority."
  },
  "provenance": {
    "source_mode": "synthetic",
    "generator": "m1-fixture-builder",
    "seed": 1,
    "no_real_site_data": true
  },
  "limitations": [
    "Synthetic contract fixture; not operational evidence."
  ]
}
