{
  "contract_version": "1.0.0",
  "record_id": "HANDOVER-SYN-002",
  "scenario_id": "SCENARIO-SYN-002",
  "synthetic": true,
  "generated_at": "2026-01-15T18:00:00Z",
  "handover_at": "2026-01-15T17:30:00Z",
  "shift_window": {
    "start": "2026-01-15T06:00:00Z",
    "end": "2026-01-15T18:00:00Z"
  },
  "work_front": {
    "id": "WF-SYN-002",
    "label": "Synthetic work front 2",
    "scope_summary": "Fictional maintenance coordination scenario.",
    "overall_state": "reported_complete",
    "change_since_last": "Synthetic state change recorded for contract testing."
  },
  "incoming_view": {
    "headline": "Completion is reported; supporting evidence remains pending.",
    "priority_condition": "evidence_gap",
    "blockers": [
      "Evidence review has not been recorded."
    ],
    "next_actions": [
      {
        "action_id": "ACT-SYN-002",
        "description": "Obtain and review the missing synthetic evidence.",
        "owner_role": "incoming_supervisor",
        "timing": "next_shift"
      }
    ]
  },
  "assertions": [
    {
      "assertion_id": "AST-SYN-002",
      "subject": "Synthetic task state",
      "reported_state": "reported_complete",
      "evidence_disposition": "pending",
      "evidence_refs": [],
      "confidence": "low",
      "observed_at": "2026-01-15T17:20:00Z",
      "limitations": [
        "Synthetic scenario; no field verification."
      ]
    }
  ],
  "evidence_items": [],
  "interruptions": [],
  "authority_boundary": {
    "authorizes_work": false,
    "confirms_isolation": false,
    "approves_permit": false,
    "declares_safe": false,
    "statement": "Evidence record only. Follow site procedures and competent-person authority."
  },
  "provenance": {
    "source_mode": "synthetic",
    "generator": "m1-fixture-builder",
    "seed": 2,
    "no_real_site_data": true
  },
  "limitations": [
    "Synthetic contract fixture; not operational evidence."
  ]
}
