{
  "contract_version": "1.0.0",
  "record_id": "HANDOVER-SYN-003",
  "scenario_id": "SCENARIO-SYN-003",
  "synthetic": true,
  "generated_at": "2026-01-15T18:00:00Z",
  "handover_at": "2026-01-15T17:30:00Z",
  "shift_window": {
    "start": "2026-01-15T06:00:00Z",
    "end": "2026-01-15T18:00:00Z"
  },
  "work_front": {
    "id": "WF-SYN-003",
    "label": "Synthetic work front 3",
    "scope_summary": "Fictional maintenance coordination scenario.",
    "overall_state": "unknown",
    "change_since_last": "Synthetic state change recorded for contract testing."
  },
  "incoming_view": {
    "headline": "Two synthetic sources conflict; current state is unknown.",
    "priority_condition": "conflict",
    "blockers": [
      "Conflicting state reports require human review."
    ],
    "next_actions": [
      {
        "action_id": "ACT-SYN-003",
        "description": "Reconcile the two synthetic evidence records.",
        "owner_role": "incoming_supervisor",
        "timing": "immediate"
      }
    ]
  },
  "assertions": [
    {
      "assertion_id": "AST-SYN-003",
      "subject": "Synthetic task state",
      "reported_state": "unknown",
      "evidence_disposition": "conflicting",
      "evidence_refs": [
        "EV-SYN-003-A",
        "EV-SYN-003-B"
      ],
      "confidence": "unknown",
      "observed_at": "2026-01-15T17:20:00Z",
      "limitations": [
        "Synthetic scenario; no field verification."
      ]
    }
  ],
  "evidence_items": [
    {
      "evidence_id": "EV-SYN-003-A",
      "synthetic": true,
      "evidence_type": "communication",
      "captured_at": "2026-01-15T17:05:00Z",
      "source_role": "synthetic_role_a",
      "integrity_status": "contradictory"
    },
    {
      "evidence_id": "EV-SYN-003-B",
      "synthetic": true,
      "evidence_type": "system_event",
      "captured_at": "2026-01-15T17:10:00Z",
      "source_role": "synthetic_system",
      "integrity_status": "contradictory"
    }
  ],
  "interruptions": [],
  "authority_boundary": {
    "authorizes_work": false,
    "confirms_isolation": false,
    "approves_permit": false,
    "declares_safe": false,
    "statement": "Evidence record only. Follow site procedures and competent-person authority."
  },
  "provenance": {
    "source_mode": "synthetic",
    "generator": "m1-fixture-builder",
    "seed": 3,
    "no_real_site_data": true
  },
  "limitations": [
    "Synthetic contract fixture; not operational evidence."
  ]
}
